"Medicijn","Dosisaanpassing","Type","Antwoord"
"Quetiafair 25 mg, filmomhulde tabletten","De werkzaamheid en de veiligheid zijn nog niet vastgesteld bij patiënten ouder dan 65 jaar met depressieve episodes in het kader van bipolaire stoornis.","Ouderen","Niet onderzocht"
"Quetiafair 25 mg, filmomhulde tabletten","Er is geen dosisaanpassing nodig voor patiënten met nierinsufficiëntie.","Nierinsufficiëntie","Geen dosisaanpassing"
"Quetiafair 25 mg, filmomhulde tabletten","Quetiapine wordt uitgebreid gemetaboliseerd door de lever. Quetiafair moet daarom met voorzichtigheid worden toegepast bij patiënten met leverinsufficiëntie, met name gedurende de initiële doseringsperiode","Leverinsufficiëntie","Geen dosisaanpassing"
"Quinapril Aurobindo 5 mg, 10 mg, 20 mg, 40 mg, filmomhulde tabletten.","In patiënten met nierinsufficiëntie dient het volgende doseringsvoorschrift te worden aangehouden. Nierstatus creatinineklaring (ml/min) aanvangsdosis (mg/dag) Lichte stoornis 30-80 5-10 Matige stoornis 10-30 2.5-5","Nierinsufficiëntie","Wel dosisaanpassing"
"Quinapril Aurobindo 5 mg, 10 mg, 20 mg, 40 mg, filmomhulde tabletten.","Patiënten met (pre)terminale nierinsufficiëntie (creatinineklaring < 10 ml/min.) en dialysepatiënten zijn onvoldoende onderzocht.","Nierinsufficiëntie","Niet onderzocht"
"Quinapril Aurobindo 5 mg, 10 mg, 20 mg, 40 mg, filmomhulde tabletten.","Fysiologische veranderingen gepaard gaande met het ouder worden kunnen het effect op de behandeling bij hypertensie beïnvloeden Tevens dalen de vormings- en eliminatiesnelheid van quinaprilaat bij patiënten boven de 65 jaar en komen goed overeen met een nierinsufficiëntie zoals regelmatig bij ouderen wordt waargenomen. Leeftijd op zich lijkt de werkzaamheid of veiligheid van quinapril niet te beïnvloeden. Aangezien de nierfunctie lijkt achteruit te gaan bij het ouder worden, is de aanbevolen aanvangsdosis in deze patiënten 5 mg quinapril éénmaal daags, gevolgd door titratie tot het optimale effect.","Ouderen","Wel dosisaanpassing"
"Quinapril Aurobindo 5 mg, 10 mg, 20 mg, 40 mg, filmomhulde tabletten.","De combinatie quinapril/hydrochloorthiazide is gecontra-indiceerd bij patiënten met ernstige nierfunctiestoornissen (creatinineklaring < 30 ml/min).","Nierinsufficiëntie","Gecontra-indiceerd"
"Quinapril Aurobindo 5 mg, 10 mg, 20 mg, 40 mg, filmomhulde tabletten.","Bij patiënten met een creatinineklaring tussen 30 en 80 ml/min mag de combinatie alleen gebruikt worden na titratie van de individuele componenten. De aanbevolen startdosering van quinapril als monotherapie bij deze patiënten bedraagt 5 mg (zie 4.4).","Nierinsufficiëntie","Niet onderzocht"
"Quinapril Aurobindo 5 mg, 10 mg, 20 mg, 40 mg, filmomhulde tabletten.","Klinische studies van de combinatie quinapril en hydrochloorthiazide hebben niet aangetoond dat leeftijd is gerelateerd met enige verandering in de werkzaamheid of tolerantie.","Ouderen","Geen dosisaanpassing"
"Ramipril Accord 1,25 mg, capsule hard","Bij patiënten met leverinsufficiëntie mag de behandeling met ramipril alleen onder strikt medisch toezicht worden opgestart","Leverinsufficiëntie","Geen dosisaanpassing"
"Ramipril Accord 1,25 mg, capsule hard","De startdoseringen moeten lager zijn en de daarop volgende dosistitraties moeten geleidelijker zijn omwille van een groter risico op bijwerkingen, in het bijzonder bij zeer oude en fragiele patiënten.","Ouderen","Wel dosisaanpassing"
"Ramipril Accord 1,25 mg, capsule hard","Een verlaagde startdosis van 1,25 mg ramipril moet in overweging worden genomen.","Ouderen","Wel dosisaanpassing"
"OKEDI 75 mg poeder en oplosmiddel voor suspensie voor injectie met verlengde afgifte","De werkzaamheid en veiligheid van OKEDI bij ouderen > 65 jaar zijn niet vastgesteld voor de OKEDI suspensie voor injectie met verlengde afgifte.","Ouderen","Niet onderzocht"
"OKEDI 75 mg poeder en oplosmiddel voor suspensie voor injectie met verlengde afgifte","Bij ouderen moet OKEDI met voorzichtigheid worden gebruikt. Vóór toediening van OKEDI moet de verdraagbaarheid van ≥ 3 mg oraal risperidon per dag op betrouwbare wijze zijn vastgesteld.","Ouderen","Geen dosisaanpassing"
"OKEDI 75 mg poeder en oplosmiddel voor suspensie voor injectie met verlengde afgifte","In het algemeen is de aanbevolen dosering van risperidon voor oudere patiënten met een normale nierfunctie dezelfde als die voor volwassen patiënten met een normale nierfunctie.","Ouderen","Geen dosisaanpassing"
"OKEDI 75 mg poeder en oplosmiddel voor suspensie voor injectie met verlengde afgifte","OKEDI is niet systematisch onderzocht bij patiënten met een nierfunctiestoornis","Nierinsufficiëntie","Niet onderzocht"
"OKEDI 75 mg poeder en oplosmiddel voor suspensie voor injectie met verlengde afgifte","Voor patiënten met een lichte nierfunctiestoornis (creatinineklaring 60 tot 89 ml/min) is voor OKEDI geen dosisaanpassing nodig.","Nierinsufficiëntie","Geen dosisaanpassing"
"OKEDI 75 mg poeder en oplosmiddel voor suspensie voor injectie met verlengde afgifte","OKEDI wordt niet aanbevolen bij patiënten met een matige tot ernstige nierfunctiestoornis (creatinineklaring < 60 ml/min).","Nierinsufficiëntie","Gecontra-indiceerd"
"OKEDI 75 mg poeder en oplosmiddel voor suspensie voor injectie met verlengde afgifte","OKEDI is niet systematisch onderzocht bij patiënten met een leverfunctiestoornis. Patiënten met een leverfunctiestoornis hebben een verhoogde plasmaconcentratie van de vrije fractie van risperidon.","Leverinsufficiëntie","Niet onderzocht"
"RISPERDAL 0,5 mg, filmomhulde tabletten","Bij alle indicaties dienen de startdosis en de daarop volgende doseringen bij patiënten met nier- of leverinsufficiëntie te worden gehalveerd en dient titratie van de dosis langzamer te gebeuren.","Leverinsufficiëntie","Wel dosisaanpassing"
"Rivaroxaban Accord 2,5 mg filmomhulde tabletten","Beperkte klinische gegevens voor patiënten met ernstige nierinsufficiëntie (creatinineklaring 15- 29 ml/min) laten zien dat de plasmaconcentraties rivaroxaban significant verhoogd zijn. Daarom is voorzichtigheid geboden bij gebruik van Rivaroxaban Accord door deze patiënten","Nierinsufficiëntie","Geen dosisaanpassing"
"Rivaroxaban Accord 2,5 mg filmomhulde tabletten","Het gebruik wordt niet aanbevolen bij patiënten met creatinineklaring < 15 ml/min (zie rubriek 4.4 en 5.2).","Nierinsufficiëntie","Gecontra-indiceerd"
"Rivaroxaban Accord 2,5 mg filmomhulde tabletten","De dosering hoeft niet te worden aangepast voor patiënten met lichte nierinsufficiëntie (creatinineklaring 50-80 ml/min) of matige nierinsufficiëntie (creatinineklaring 30-49 ml/min) (zie rubriek 5.2).","Nierinsufficiëntie","Geen dosisaanpassing"
"Rivaroxaban Accord 2,5 mg filmomhulde tabletten","Rivaroxaban Accord is gecontra-indiceerd bij patiënten met een leveraandoening die gepaard gaat met coagulopathie en een klinisch relevant bloedingsrisico, waaronder cirrotische patiënten met ChildPugh B en C (zie rubriek 4.3 en 5.2).","Leverinsufficiëntie","Gecontra-indiceerd"
"Rivaroxaban Accord 2,5 mg filmomhulde tabletten","Geen doseringsaanpassing (zie rubriek 4.4 en 5.2) Het risico van een bloeding neemt toe bij toenemende leeftijd (zie rubriek 4.4).","Ouderen","Geen dosisaanpassing"
"Rivaroxaban Intas 15 mg, filmomhulde tabletten","Er zijn geen klinische gegevens beschikbaar van kinderen met leverinsufficiëntie.","Leverinsufficiëntie","Niet onderzocht"
"Rivaroxaban Intas 15 mg, filmomhulde tabletten","Geen doseringsaanpassing (zie rubriek 5.2)","Ouderen","Geen dosisaanpassing"
"Cholecomb 10 mg/10 mg, capsule, hard","Er is geen aanpassing nodig bij patiënten met milde tot matige nierstoornis.","Nierinsufficiëntie","Geen dosisaanpassing"
"Cholecomb 10 mg/10 mg, capsule, hard","Het gebruik van rosuvastatine bij patiënten met ernstige nierstoornis is gecontra-indiceerd voor alle doses (zie rubriek 4.3 en 5.2).","Nierinsufficiëntie","Gecontra-indiceerd"
"Cholecomb 10 mg/10 mg, capsule, hard","Er is geen dosisaanpassing vereist bij patiënten met milde leverinsufficiëntie (Child Pugh score 5 tot 6).","Leverinsufficiëntie","Geen dosisaanpassing"
"Cholecomb 10 mg/10 mg, capsule, hard","Behandeling met Cholecomb is niet aanbevolen bij patiënten met matige (Child Pugh score 7 tot 9) of ernstige (Child Pugh score >9) leverfunctiestoornis (zie rubriek 4.4 en 5.2.)","Leverinsufficiëntie","Gecontra-indiceerd"
"Cholecomb 10 mg/10 mg, capsule, hard","Cholecomb is gecontra-indiceerd bij patiënten met actieve leverziekte (zie rubriek 4.3).","Leverinsufficiëntie","Gecontra-indiceerd"
"Crestor 5, filmomhulde tabletten 5 mg","Er is geen andere doseringsaanpassing nodig in relatie tot leeftijd.","Ouderen","Geen dosisaanpassing"
"Crestor 5, filmomhulde tabletten 5 mg","Bij patiënten met milde tot matige nierinsufficiëntie is het niet nodig de dosering aan te passen. ","Nierinsufficiëntie","Geen dosisaanpassing"
"Crestor 5, filmomhulde tabletten 5 mg","Het gebruik van Crestor bij patiënten met een ernstige nierinsufficiëntie is gecontraindiceerd voor alle doseringen (zie rubriek 4.3 en 5.2).","Nierinsufficiëntie","Gecontra-indiceerd"
"Crestor 5, filmomhulde tabletten 5 mg","Er is geen toegenomen systemische blootstelling aan rosuvastatine bij patiënten met een Child-Pugh score van 7 of lager waargenomen.","Leverinsufficiëntie","Geen dosisaanpassing"
"Crestor 5, filmomhulde tabletten 5 mg","Er is geen ervaring bij patiënten met een Child-Pugh score hoger dan 9","Leverinsufficiëntie","Niet onderzocht"
"Crestor 5, filmomhulde tabletten 5 mg","Crestor is gecontra-indiceerd in patiënten met een actieve leverziekte (zie rubriek 4.3).","Leverinsufficiëntie","Gecontra-indiceerd"
"Asentra 50 mg filmomhulde tabletten","Bij ouderen dient voorzichtig gedoseerd te worden, aangezien het risico op hyponatriëmie bij ouderen hoger kan zijn (zie rubriek 4.4).","Ouderen","Geen dosisaanpassing"
"Asentra 50 mg filmomhulde tabletten","Het gebruik van sertraline bij patiënten met leveraandoeningen dient voorzichtig te geschieden. Bij patiënten met leverfunctiestoornissen dient een lagere of minder frequente dosis te worden gebruikt (zie rubriek 4.4).","Leverinsufficiëntie","Wel dosisaanpassing"
"Asentra 50 mg filmomhulde tabletten","Sertraline dient niet gebruikt te worden in geval van ernstige leverfunctiestoornis aangezien hiervoor geen klinische gegevens beschikbaar zijn (zie rubriek 4.4).","Leverinsufficiëntie","Gecontra-indiceerd"
"Asentra 50 mg filmomhulde tabletten","Aanpassing van de dosering bij patiënten met nierinsufficiëntie is niet nodig (zie rubriek 4.4).","Nierinsufficiëntie","Geen dosisaanpassing"
"Balcoga 20 mg, filmomhulde tabletten","Dosisaanpassingen zijn niet nodig bij ouderen. De klinische werkzaamheid, gemeten als de 6- minutenloopafstand, zou minder kunnen zijn bij ouderen.","Ouderen","Geen dosisaanpassing"
"Balcoga 20 mg, filmomhulde tabletten","Bij patiënten met nierinsufficiëntie is aanpassing van de dosering niet nodig, ook niet bij patiënten met ernstige nierinsufficiëntie (creatinineklaring","Nierinsufficiëntie","Geen dosisaanpassing"
"Balcoga 20 mg, filmomhulde tabletten","Bij patiënten met leveninsufficiëntie (Child-Pugh klasse A en B) is aanpassing van de dosering niet a priori nodig.","Leverinsufficiëntie","Geen dosisaanpassing"
"Balcoga 20 mg, filmomhulde tabletten","Balcoga is gecontra-indiceerd bij patiënten met ernstige leveninsufficëntie (Child-Pugh klasse C) (zie rubriek 4.3).","Leverinsufficiëntie","Gecontra-indiceerd"
"SILANDYL 100 mg, orodispergeerbare film","Aanpassingen in de dosering zijn bij ouderen (≥ 65 jaar) niet nodig","Ouderen","Geen dosisaanpassing"
"SILANDYL 100 mg, orodispergeerbare film","De doseringsaanbevelingen beschreven in 'Gebruik bij volwassenen' gelden ook voor patiënten met licht tot matig verminderde nierfunctie (creatinineklaring = 30-80 ml/min).","Nierinsufficiëntie","Geen dosisaanpassing"
"Efficib 50 mg/850 mg filmomhulde tabletten","Voor patiënten met een lichte nierfunctiestoornis (glomerulaire filtratiesnelheid [GFR] ≥ 60 ml/min) is geen dosisaanpassing nodig. Voor aanvang van de behandeling met metformine-bevattende middelen dient een GFR te worden bepaald, en ten minste jaarlijks daarna. B","Nierinsufficiëntie","Geen dosisaanpassing"
"Efficib 50 mg/850 mg filmomhulde tabletten","Efficib moet niet worden gebruikt bij patiënten met een leverfunctiestoornis (zie rubriek 5.2)","Leverinsufficiëntie","Gecontra-indiceerd"
"Efficib 50 mg/850 mg filmomhulde tabletten","Bij oudere patiënten moet Efficib voorzichtig worden gebruikt omdat metformine en sitagliptine door de nieren worden uitgescheiden. Met name in deze groep is controle van de nierfunctie noodzakelijk om metforminegerelateerde lactaatacidose te helpen voorkomen (zie rubrieken 4.3 en 4.4).",,"Geen dosisaanpassing"
"Bactrimel, concentraat voor oplossing voor intraveneuze infusie 96 mg/ml","Bij een normale lever- en nierfunctie is geen dosisaanpassing noodzakelijk","Ouderen","Geen dosisaanpassing"
"Bactrimel, concentraat voor oplossing voor intraveneuze infusie 96 mg/ml","Het gebruik van co-trimoxazol is gecontra-indiceerd, zie rubriek 4.3","Nierinsufficiëntie","Gecontra-indiceerd"
"Bactrimel, concentraat voor oplossing voor intraveneuze infusie 96 mg/ml","Bij patiënten met lever- en/of nierfunctiestoornissen, moet de dosering worden verlaagd of het doseringsinterval worden aangepast (zie ook rubriek 4.4).","Leverinsufficiëntie","Wel dosisaanpassing"
"Co-trimoxazol Teva 200/40 mg/5 ml, suspensie voor oraal gebruik","Bij patiënten met lever- en/of nierfunctiestoornissen, dient de dosering te worden verlaagd of het doseringsinterval te worden aangepast, zoals weergegeven in onderstaande tabel (zie ook rubriek 4.4).","Leverinsufficiëntie","Wel dosisaanpassing"
"Imigran FTAB 50, dispergeerbare tabletten 50 mg","Er is beperkte ervaring met het gebruik van sumatriptan bij patiënten ouder dan 65 jaar. De kinetiek bij ouderen is echter nog onvoldoende onderzocht","Ouderen","Niet onderzocht"
"Imigran FTAB 50, dispergeerbare tabletten 50 mg","De veiligheid bij ouderen is nog onvoldoende onderzocht. Daarom wordt, totdat meer gegevens beschikbaar zijn, het gebruik van sumatriptan bij oudere patiënten niet aangeraden.","Ouderen","Gecontra-indiceerd"
"Imigran FTAB 50, dispergeerbare tabletten 50 mg","Sumatriptan dient met voorzichtigheid te worden gebruikt bij patiënten met nierinsufficiëntie.","Nierinsufficiëntie","Geen dosisaanpassing"
"Adport 0,5 mg, capsules, hard","Verlaging van de dosis kan noodzakelijk zijn bij patiënten met een ernstig gestoorde leverfunctie om de dal-bloedconcentraties binnen de aanbevolen marges te houden.","Leverinsufficiëntie","Wel dosisaanpassing"
"Adport 0,5 mg, capsules, hard","Daar de nierfunctie geen invloed op de farmacokinetiek van tacrolimus heeft, zullen op grond hiervan geen doseringsaanpassingen noodzakelijk zijn. Echter, gezien de potentiële nefrotoxiciteit van tacrolimus wordt aanbevolen de nierfunctie zorgvuldig te controleren (inclusief seriële metingen van creatinineconcentratie, berekening van de creatinineklaring en bepaling van het urinevolume).","Nierinsufficiëntie","Geen dosisaanpassing"
"Adport 0,5 mg, capsules, hard","Op dit ogenblik zijn er geen aanwijzingen om aan te nemen dat bij ouderen de dosering moet worden aangepast","Ouderen","Geen dosisaanpassing"
"Advagraf 0,5 mg capsules met verlengde afgifte, hard","Verlaging van de dosis kan noodzakelijk zijn bij patiënten met een ernstig gestoorde leverfunctie om de tacrolimusbloeddalspiegels binnen de aanbevolen marges te houden.","Leverinsufficiëntie","Wel dosisaanpassing"
"Advagraf 0,5 mg capsules met verlengde afgifte, hard","Daar de nierfunctie geen invloed op de farmacokinetiek van tacrolimus heeft (zie rubriek 5.2), is op grond hiervan geen dosisaanpassing noodzakelijk. ","Nierinsufficiëntie","Geen dosisaanpassing"
"Advagraf 0,5 mg capsules met verlengde afgifte, hard","Er zijn geen aanwijzingen om aan te nemen dat bij ouderen de dosis moet worden aangepast.","Ouderen","Geen dosisaanpassing"
"ADCIRCA 20 mg filmomhulde tabletten","Patiënten met ernstige levercirrose (Child-Pugh klasse C) zijn niet onderzocht en daarom wordt toediening van tadalafil niet aanbevolen (zie rubriek 4.4 en 5.2).","Leverinsufficiëntie","Gecontra-indiceerd"
"ADCIRCA 20 mg filmomhulde tabletten","Bij oudere patiënten zijn dosisaanpassingen niet noodzakelijk.","Ouderen","Geen dosisaanpassing"
"ADCIRCA 20 mg filmomhulde tabletten","Bij patiënten met een ernstig verminderde nierfunctie wordt gebruik van tadalafil niet aanbevolen (zie rubriek 4.4 en 5.2). ","Nierinsufficiëntie","Gecontra-indiceerd"
"Combodart 0,5 mg/0,4 mg harde capsules","Het effect van een verminderde nierfunctie op de farmacokinetiek van dutasteride-tamsulosine is niet onderzocht","Nierinsufficiëntie","Niet onderzocht"
"Combodart 0,5 mg/0,4 mg harde capsules","Het wordt niet verwacht dat aanpassing van de dosering nodig is bij patiënten met een verminderde nierfunctie (zie rubrieken 4.4 en 5.2).","Nierinsufficiëntie","Geen dosisaanpassing"
"Combodart 0,5 mg/0,4 mg harde capsules","Het effect van een verminderde leverfunctie op de farmacokinetiek van dutasteride-tamsulosine is niet onderzocht; daarom moet voorzichtigheid worden betracht bij patiënten met een licht tot matig verminderde leverfunctie (zie rubrieken 4.4 en 5.2).","Leverinsufficiëntie","Niet onderzocht"
"Combodart 0,5 mg/0,4 mg harde capsules","Het gebruik van Combodart is gecontra-indiceerd bij patiënten met een ernstig verminderde leverfunctie (zie rubriek 4.3).","Leverinsufficiëntie","Gecontra-indiceerd"
"Tamsulosine HCl Krka 0,4 mg harde capsules met gereguleerde afgifte","Bij nierinsufficiëntie is aanpassing van de dosering niet nodig.","Nierinsufficiëntie","Geen dosisaanpassing"
"Tamsulosine HCl Krka 0,4 mg harde capsules met gereguleerde afgifte","Er is geen dosisaanpassing nodig bij patiënten met milde tot matige leverinsufficiëntie (zie ook 4.3 Contra-indicaties).","Leverinsufficiëntie","Geen dosisaanpassing"
"Temazepam CF 10 mg, capsules","Patiënten met leverfunctiestoornissen moeten een lagere dosis krijgen","Leverinsufficiëntie","Wel dosisaanpassing"
"Terbinafine Aurobindo 125 mg, tabletten","Er zijn geen gegevens beschikbaar waaruit blijkt dat ouderen een andere dosering nodig hebben dan jongeren, of dat zij andere bijwerkingen hebben in vergelijking met jongere patiënten. Bij ouderen moet men echter wel rekening houden met de mogelijkheid van een reeds bestaande nier- of leverinsufficiëntie (zie rubriek 4.4 Bijzonderewaarschuwingen en voorzorgen bij gebruik).","Ouderen","Geen dosisaanpassing"
"Terbinafine Aurobindo 125 mg, tabletten","Het gebruik van terbinafinetabletten is onvoldoende onderzocht bij patiënten met nierinsufficiëntie en wordt daarom niet aanbevolen voor deze populatie (zie rubriek 4.4 Bijzondere waarschuwingen en voorzorgen bij gebruik).","Nierinsufficiëntie","Gecontra-indiceerd"
"Terbinafine Aurobindo 125 mg, tabletten","Terbinafine wordt niet aanbevolen bij patiënten met chronische of actieve leveraandoeningen (zie rubriek 4.4 Bijzondere waarschuwingen en voorzorgen bij gebruik)","Leverinsufficiëntie","Gecontra-indiceerd"
"Terbinafine Sandoz 250 mg, tabletten","Er zijn geen aanwijzingen dat oudere patiënten (van 65 jaar en ouder) een andere dosering nodig zouden hebben of andere bijwerkingen zouden ervaren dan jongere patiënten","Ouderen","Geen dosisaanpassing"
"Terbinafine Sandoz 250 mg, tabletten","Het gebruik van terbinafine is niet adequaat onderzocht","Nierinsufficiëntie","Niet onderzocht"
"Terbinafine Sandoz 250 mg, tabletten","Terbinafine wordt niet aanbevolen bij patiënten met een chronische of actieve leverziekte (zie rubrieken 4.3 en 4.4).","Leverinsufficiëntie","Gecontra-indiceerd"
"Sirdalud MR 6 mg, capsules met gereguleerde afgifte","Bij patiënten met significante leverfunctiestoornissen is het gebruik van Sirdalud MR gecontra-indiceerd (zie rubriek 4.3).","Leverinsufficiëntie","Gecontra-indiceerd"
"Sirdalud MR 6 mg, capsules met gereguleerde afgifte","Sirdalud dient met voorzichtigheid gebruikt te worden bij patiënten met een milde vorm van verminderde leverfunctie en de behandeling dient met de laagst mogelijke dosis te worden gestart. Verhoging van de dosering dient met voorzichtigheid te geschieden op geleide van de verdraagzaamheid van de patiënt.","Leverinsufficiëntie","Geen dosisaanpassing"
"Sirdalud MR 6 mg, capsules met gereguleerde afgifte","Ervaring met het gebruik van Sirdalud bij ouderen is beperkt. Het wordt aanbevolen de behandeling te starten met de laagst mogelijke dosis en het verhogen van de dosering dient met kleine stappen en op geleide van verdraagbaarheid en werkzaamheid te gebeuren","Ouderen","Geen dosisaanpassing"
"Sirdalud MR 6 mg, capsules met gereguleerde afgifte","Er bestaat een beperkte ervaring met het gebruik van Tizanidine Teva bij ouderen. Aangezien bij ouderen de nierfunctie kan afnemen, kan dientengevolge de renale klaring van tizanidine afnemen. Daarom is voorzichtigheid geboden indien Tizanidine Teva wordt toegepast bij oudere patiënten.","Ouderen","Geen dosisaanpassing"
"Topamax Sprinkle 15 mg, harde capsules","Bij patiënten met matige tot ernstige leverinsufficiëntie dient topiramaat met voorzichtigheid te worden toegediend omdat de klaring van topiramaat is verminderd.","Leverinsufficiëntie","Geen dosisaanpassing"
"Topamax Sprinkle 15 mg, harde capsules","De dosering hoeft niet te worden aangepast bij ouderen, op voorwaarde dat de nieren goed functioneren","Ouderen","Geen dosisaanpassing"
"Topamax Sprinkle 15 mg, harde capsules","Bij patiënten met nierinsufficiëntie (CLCR ≤ 70 ml/min) dient topiramaat met voorzichtigheid te worden toegediend omdat de plasma- en renale klaring van topiramaat zijn verminderd. ","Nierinsufficiëntie","Geen dosisaanpassing"
"Topamax Sprinkle 15 mg, harde capsules","Bij personen met een bekende nierinsufficiëntie kan meer tijd nodig zijn voor het bereiken van de steady-state na elke dosis. De helft van de gebruikelijke start- en onderhoudsdosis wordt aanbevolen (zie rubriek 5.2).","Nierinsufficiëntie","Wel dosisaanpassing"
"Skudexa 75 mg/25 mg filmomhulde tabletten","De initiële totale dagelijkse dosis moet verminderd worden tot 2 filmomhulde tabletten Skudexa bij patiënten met een licht verminderde nierfunctie (creatinineklaring van 60 tot 89 ml/min) (zie rubriek 4.4).","Nierinsufficiëntie","Wel dosisaanpassing"
"Skudexa 75 mg/25 mg filmomhulde tabletten","Skudexa mag niet gebruikt worden bij patiënten met matige tot ernstige nierinsufficiëntie (creatinineklaring ≤ 59 ml/min) (zie rubriek 4.3).","Nierinsufficiëntie","Gecontra-indiceerd"
"Skudexa 75 mg/25 mg filmomhulde tabletten","Skudexa mag niet gebruikt worden bij patiënten met een ernstige leverinsufficiëntie (zie rubriek 4.3).","Leverinsufficiëntie","Gecontra-indiceerd"
"Skudexa 75 mg/25 mg filmomhulde tabletten","Patiënten met een lichte tot matige leverinsufficiëntie moeten de behandeling beginnen met een lagere dosis (totale dagelijkse dosis van 2 filmomhulde tabletten Skudexa) en moeten nauw gevolgd worden.","Leverinsufficiëntie","Wel dosisaanpassing"
"Skudexa 75 mg/25 mg filmomhulde tabletten","Er zijn beperkte gegevens beschikbaar bij patiënten ouder dan 75 jaar.","Ouderen","Niet onderzocht"
"Tramadol HCl Aurobindo Retard 100 mg, tabletten met gereguleerde afgifte","In de regel is een aanpassing van de dosering bij oudere patiënten (tot 75 jaar) zonder klinisch manifeste lever- of nierinsufficiëntie niet noodzakelijk","Ouderen","Geen dosisaanpassing"
"Tramadol HCl Aurobindo Retard 100 mg, tabletten met gereguleerde afgifte","De uitscheiding van tramadol is vertraagd bij patiënten met nier en/of leverfunctiestoornis. Bij deze patiënten dient verlenging van het doseringsinterval zorgvuldig te worden overwogen, aan de hand van de behoefte van de patiënt.","Leverinsufficiëntie","Wel dosisaanpassing"
"Tramadol HCl Aurobindo Retard 100 mg, tabletten met gereguleerde afgifte","Bij oudere patiënten (ouder dan 75 jaar) kan de uitscheiding zijn verlengd. Daarom moet in dat geval het doseringsinterval individueel worden verlengd.","Ouderen","Wel dosisaanpassing"
"Tramadol HCl Aurobindo Retard 100 mg, tabletten met gereguleerde afgifte","De uitscheiding van tramadol is vertraagd bij patiënten met nier en/of leverfunctiestoornis. Bij deze patiënten dient verlenging van het doseringsinterval zorgvuldig te worden overwogen, aan de hand van de behoefte van de patiënt.","Nierinsufficiëntie","Wel dosisaanpassing"
"Trazodone HCl GenRX 50 mg, tabletten","Voor zeer oude, of zwakke patienten, is de aanbevolen dosis verlaagd tot 100 mg per dag, verdeeld over meerdere giften of als één enkele dosering voor het slapen gaan (zie rubriek 4.4). Dit mag, onder toezicht, geleidelijk worden verhoogd, zoals beschreven onder volwassenen, naar tolerantie en werkzaamheid. I","Ouderen","Wel dosisaanpassing"
"Trazodone HCl GenRX 50 mg, tabletten","Trazodone ondergaat uitgebreid levermetabolisme, zie rubriek 5.2, en wordt ook geassocieerd met levertoxiciteit, zie rubriek 4.4 en 4.8. Daarom moet extra voorzichtigheid in acht genomen worden bij het voorschrijven aan patienten met leverfunctiestoornissen, vooral in gevallen van ernstige leverfunctiestoonis","Leverinsufficiëntie","Geen dosisaanpassing"
"Trazodone HCl GenRX 50 mg, tabletten","Aanpassing van de dosis is meestal niet noodzakelijk, maar voorzichtigheid dient in acht te worden genomen bij het voorschrijven aan patienten met nierfunctiestoornissen ( zie ook rubriek 4.4 en 5.2).","Nierinsufficiëntie","Geen dosisaanpassing"
"Amlodipine/Valsartan Aurobindo 5/80 mg, filmomhulde tabletten","Er zijn geen klinische gegevens beschikbaar met betrekking tot patiënten met ernstige nierinsufficiëntie.","Nierinsufficiëntie","Niet onderzocht"
